<?xml version="1.0" encoding="UTF-8"?>
<tns:ForberedelseUnderlag xmlns:tns="http://www.example.org/metaSchema" xmlns:xsi="http://www.w3.org/2001/XMLSchema-instance" xsi:schemaLocation="http://www.example.org/metaSchema ../schema/DocSchema.xsd ">
  <tns:AnkomstDatum>2001-01-01</tns:AnkomstDatum>
  <tns:TidsStampel>12:00:00</tns:TidsStampel>
  <tns:TotalLaddning>true</tns:TotalLaddning>
  <tns:Filer>
    <tns:Fil amne="GrundOchMarginal">GrundMarginal.xml</tns:Fil>
    <tns:Fil amne="GrundOchMarginal">GrundMarginalInvalid.xml</tns:Fil>
    <tns:Fil amne="AldersInverkan">AldersInverkan.xml</tns:Fil>
    <tns:Fil amne="GrundOchMarginal">GrundMarginalMultuValues.xml</tns:Fil>
  </tns:Filer>
</tns:ForberedelseUnderlag>
